{
  "source": "source/video.mp4",
  "duration": 24.0,
  "fps_sampled": 1.0,
  "width": 480,
  "height": 270,
  "metric": "hist_l1_0.75+luma_0.25",
  "generated_at": "2026-09-24T21:03:11+08:00",
  "changes": [
    {
      "t": 0.0,
      "score": 0.0
    },
    {
      "t": 1.0,
      "score": 0.012
    },
    {
      "t": 2.0,
      "score": 0.007
    },
    {
      "t": 3.0,
      "score": 0.009
    },
    {
      "t": 4.0,
      "score": 0.011
    },
    {
      "t": 5.0,
      "score": 0.008
    },
    {
      "t": 6.0,
      "score": 0.01
    },
    {
      "t": 7.0,
      "score": 0.009
    },
    {
      "t": 8.0,
      "score": 0.013
    },
    {
      "t": 9.0,
      "score": 0.62
    },
    {
      "t": 10.0,
      "score": 0.18
    },
    {
      "t": 11.0,
      "score": 0.24
    },
    {
      "t": 12.0,
      "score": 0.31
    },
    {
      "t": 13.0,
      "score": 0.27
    },
    {
      "t": 14.0,
      "score": 0.35
    },
    {
      "t": 15.0,
      "score": 0.29
    },
    {
      "t": 16.0,
      "score": 0.022
    },
    {
      "t": 17.0,
      "score": 0.014
    },
    {
      "t": 18.0,
      "score": 0.018
    },
    {
      "t": 19.0,
      "score": 0.011
    },
    {
      "t": 20.0,
      "score": 0.016
    },
    {
      "t": 21.0,
      "score": 0.013
    },
    {
      "t": 22.0,
      "score": 0.41
    },
    {
      "t": 23.0,
      "score": 0.035
    },
    {
      "t": 24.0,
      "score": 0.018
    }
  ]
}
